{
  "activitySchemaVersion": 1,
  "scope": {
    "runtime": "codex",
    "sessionId": "session-demo",
    "sourcePath": "/workspace/demo/rollout-session.jsonl",
    "captureMode": "live-read",
    "capturedAt": "2026-09-10T12:00:05Z"
  },
  "events": [
    {
      "id": "codex:session-demo:record1:call-1",
      "kind": "tool_call",
      "sequence": 1,
      "source": {
        "surface": "jsonl",
        "path": "/workspace/demo/rollout-session.jsonl",
        "physicalLine": 2,
        "logicalRecordIndex": 1,
        "jsonPointer": "/payload"
      },
      "availability": "settled",
      "nativeCallId": "call-1",
      "nativeToolName": "exec_command",
      "category": "shell",
      "input": {
        "text": "{\"cmd\":\"pnpm test parser\"}",
        "originalChars": 26,
        "omittedChars": 0,
        "source": {
          "surface": "jsonl",
          "path": "/workspace/demo/rollout-session.jsonl",
          "physicalLine": 2,
          "logicalRecordIndex": 1,
          "jsonPointer": "/payload/arguments"
        }
      },
      "enrichment": {
        "command": "pnpm test parser"
      }
    },
    {
      "id": "codex:session-demo:record2:call-1:result",
      "kind": "tool_result",
      "sequence": 2,
      "source": {
        "surface": "jsonl",
        "path": "/workspace/demo/rollout-session.jsonl",
        "physicalLine": 3,
        "logicalRecordIndex": 2,
        "jsonPointer": "/payload"
      },
      "availability": "settled",
      "nativeCallId": "call-1",
      "nativeToolName": "exec_command",
      "category": "shell",
      "relatedCallEventId": "codex:session-demo:record1:call-1",
      "output": {
        "text": "Process exited with code 1\nParser test failed.",
        "originalChars": 46,
        "omittedChars": 0,
        "source": {
          "surface": "jsonl",
          "path": "/workspace/demo/rollout-session.jsonl",
          "physicalLine": 3,
          "logicalRecordIndex": 2,
          "jsonPointer": "/payload/output"
        }
      },
      "outcome": "error",
      "outcomeEvidence": {
        "kind": "parsed-output",
        "detail": "Code 1 was parsed from provider output text. This is not an independently recorded process exit-code field.",
        "source": {
          "surface": "jsonl",
          "path": "/workspace/demo/rollout-session.jsonl",
          "physicalLine": 3,
          "logicalRecordIndex": 2,
          "jsonPointer": "/payload"
        }
      }
    }
  ],
  "toolGroups": [
    {
      "nativeToolName": "exec_command",
      "category": "shell",
      "countScope": "captured-range",
      "invocationCount": 1,
      "sampleEventIds": [
        "codex:session-demo:record1:call-1"
      ]
    }
  ],
  "metadata": [],
  "coverage": {
    "source": [
      {
        "dataClass": "tool-calls",
        "status": "available",
        "detail": "One synthetic call in the selected example range."
      },
      {
        "dataClass": "tool-results",
        "status": "available",
        "detail": "One synthetic correlated output."
      },
      {
        "dataClass": "subagents",
        "status": "not-read",
        "detail": "No child transcript was requested."
      }
    ],
    "display": {
      "eventsAvailable": 2,
      "eventsShown": 2,
      "eventsOmitted": 0,
      "payloadCharsOmitted": 0
    },
    "unmatchedCalls": 0,
    "unmatchedResults": 0,
    "warnings": [
      "Synthetic example only. No real session or native command was executed."
    ]
  }
}
